{
  "type": "DIGEST_REVIEW_DECISIONS",
  "schemaVersion": 1,
  "policy": "Every generated digest-review group needs an explicit cover, retain, or review decision before it can guide runtime replacement or cleanup. Decisions do not authorize deletion; cleanup-ledger approval remains required.",
  "entries": [
    {
      "type": "DIGEST_REVIEW_DECISION",
      "target": {
        "type": "DIGEST_REVIEW_TARGET",
        "sha256": "sha256:03f8f25b25be6267c15f42a87c15caf54fe0863d40ebf90104c4a44e93a1864c"
      },
      "decision": "RETAIN_EXTERNAL",
      "status": "DECIDED",
      "queueEvidence": {
        "type": "DIGEST_QUEUE_EVIDENCE",
        "queueType": "DIGEST_REVIEW",
        "generatedAction": "REPLACE_DUPLICATES_WITH_REFERENCES_AFTER_REVIEW",
        "priority": 2,
        "entryCount": 2,
        "buckets": [
          "authored-local",
          "runtime"
        ],
        "sourceRoots": [
          "apollo-skills",
          "global-codex-skills"
        ],
        "candidateKeys": [
          "AGENT:openai"
        ]
      },
      "rationale": "Byte-identical entries are runtime, system, first-party, or adapter material retained in owning runtimes; do not replace from this repo.",
      "nextAction": "Leave source/runtime copies in owning locations; revisit only if a dedicated plugin family is designed."
    },
    {
      "type": "DIGEST_REVIEW_DECISION",
      "target": {
        "type": "DIGEST_REVIEW_TARGET",
        "sha256": "sha256:104b792090370aff47c4a70411cb84e737b7cfa9699f2f54c916d8946fc98f16"
      },
      "decision": "RETAIN_EXTERNAL",
      "status": "DECIDED",
      "queueEvidence": {
        "type": "DIGEST_QUEUE_EVIDENCE",
        "queueType": "DIGEST_REVIEW",
        "generatedAction": "REPLACE_DUPLICATES_WITH_REFERENCES_AFTER_REVIEW",
        "priority": 2,
        "entryCount": 4,
        "buckets": [
          "authored-local",
          "backup",
          "runtime"
        ],
        "sourceRoots": [
          "apollo-skills",
          "global-agent-skills",
          "global-codex-skills",
          "global-codex-skills-backup"
        ],
        "candidateKeys": [
          "SKILL:skill-creator"
        ]
      },
      "rationale": "Byte-identical entries are runtime, system, first-party, or adapter material retained in owning runtimes; do not replace from this repo.",
      "nextAction": "Leave source/runtime copies in owning locations; revisit only if a dedicated plugin family is designed."
    },
    {
      "type": "DIGEST_REVIEW_DECISION",
      "target": {
        "type": "DIGEST_REVIEW_TARGET",
        "sha256": "sha256:3555f7bdb3a50a4ccb99be8d94d23528509b988f3f72645e03705da25594b66c"
      },
      "decision": "RETAIN_EXTERNAL",
      "status": "DECIDED",
      "queueEvidence": {
        "type": "DIGEST_QUEUE_EVIDENCE",
        "queueType": "DIGEST_REVIEW",
        "generatedAction": "REPLACE_DUPLICATES_WITH_REFERENCES_AFTER_REVIEW",
        "priority": 2,
        "entryCount": 2,
        "buckets": [
          "authored-local",
          "runtime"
        ],
        "sourceRoots": [
          "apollo-skills",
          "global-codex-skills"
        ],
        "candidateKeys": [
          "SKILL:imagegen"
        ]
      },
      "rationale": "Byte-identical entries are runtime, system, first-party, or adapter material retained in owning runtimes; do not replace from this repo.",
      "nextAction": "Leave source/runtime copies in owning locations; revisit only if a dedicated plugin family is designed."
    },
    {
      "type": "DIGEST_REVIEW_DECISION",
      "target": {
        "type": "DIGEST_REVIEW_TARGET",
        "sha256": "sha256:57134da0c1a4eea33fbd74a1c9c44aa814f07d6bc64de303edb586f941e5d21a"
      },
      "decision": "RETAIN_EXTERNAL",
      "status": "DECIDED",
      "queueEvidence": {
        "type": "DIGEST_QUEUE_EVIDENCE",
        "queueType": "DIGEST_REVIEW",
        "generatedAction": "REPLACE_DUPLICATES_WITH_REFERENCES_AFTER_REVIEW",
        "priority": 2,
        "entryCount": 5,
        "buckets": [
          "authored-local",
          "installed-marketplace",
          "runtime"
        ],
        "sourceRoots": [
          "claude-plugins",
          "global-agent-skills",
          "kast-agent-skills"
        ],
        "candidateKeys": [
          "AGENT:grader"
        ]
      },
      "rationale": "Byte-identical entries are runtime, system, first-party, or adapter material retained in owning runtimes; do not replace from this repo.",
      "nextAction": "Leave source/runtime copies in owning locations; revisit only if a dedicated plugin family is designed."
    },
    {
      "type": "DIGEST_REVIEW_DECISION",
      "target": {
        "type": "DIGEST_REVIEW_TARGET",
        "sha256": "sha256:580081dd6c0896d72307d1f1b90d2248a64b9353bc546fdbf05ddeb3848e8c39"
      },
      "decision": "RETAIN_EXTERNAL",
      "status": "DECIDED",
      "queueEvidence": {
        "type": "DIGEST_QUEUE_EVIDENCE",
        "queueType": "DIGEST_REVIEW",
        "generatedAction": "REPLACE_DUPLICATES_WITH_REFERENCES_AFTER_REVIEW",
        "priority": 2,
        "entryCount": 2,
        "buckets": [
          "authored-local",
          "runtime"
        ],
        "sourceRoots": [
          "apollo-skills",
          "global-codex-skills"
        ],
        "candidateKeys": [
          "AGENT:openai"
        ]
      },
      "rationale": "Byte-identical entries are runtime, system, first-party, or adapter material retained in owning runtimes; do not replace from this repo.",
      "nextAction": "Leave source/runtime copies in owning locations; revisit only if a dedicated plugin family is designed."
    },
    {
      "type": "DIGEST_REVIEW_DECISION",
      "target": {
        "type": "DIGEST_REVIEW_TARGET",
        "sha256": "sha256:5ce223d8b1070b82c42298538f1b8d376f788eb9e7a42a987e8c094070d73f0e"
      },
      "decision": "RETAIN_EXTERNAL",
      "status": "DECIDED",
      "queueEvidence": {
        "type": "DIGEST_QUEUE_EVIDENCE",
        "queueType": "DIGEST_REVIEW",
        "generatedAction": "REPLACE_DUPLICATES_WITH_REFERENCES_AFTER_REVIEW",
        "priority": 2,
        "entryCount": 4,
        "buckets": [
          "authored-local",
          "backup",
          "runtime"
        ],
        "sourceRoots": [
          "apollo-skills",
          "global-agent-skills",
          "global-codex-skills",
          "global-codex-skills-backup"
        ],
        "candidateKeys": [
          "AGENT:openai"
        ]
      },
      "rationale": "Byte-identical entries are runtime, system, first-party, or adapter material retained in owning runtimes; do not replace from this repo.",
      "nextAction": "Leave source/runtime copies in owning locations; revisit only if a dedicated plugin family is designed."
    },
    {
      "type": "DIGEST_REVIEW_DECISION",
      "target": {
        "type": "DIGEST_REVIEW_TARGET",
        "sha256": "sha256:67717a8afb51f29380e849cad62036628bd5a3c8193bacf3b00b5cd7a30fc1cb"
      },
      "decision": "RETAIN_EXTERNAL",
      "status": "DECIDED",
      "queueEvidence": {
        "type": "DIGEST_QUEUE_EVIDENCE",
        "queueType": "DIGEST_REVIEW",
        "generatedAction": "REPLACE_DUPLICATES_WITH_REFERENCES_AFTER_REVIEW",
        "priority": 2,
        "entryCount": 4,
        "buckets": [
          "authored-local",
          "backup",
          "runtime"
        ],
        "sourceRoots": [
          "apollo-skills",
          "global-agent-skills",
          "global-codex-skills",
          "global-codex-skills-backup"
        ],
        "candidateKeys": [
          "SKILL:skill-installer"
        ]
      },
      "rationale": "Byte-identical entries are runtime, system, first-party, or adapter material retained in owning runtimes; do not replace from this repo.",
      "nextAction": "Leave source/runtime copies in owning locations; revisit only if a dedicated plugin family is designed."
    },
    {
      "type": "DIGEST_REVIEW_DECISION",
      "target": {
        "type": "DIGEST_REVIEW_TARGET",
        "sha256": "sha256:71bc91120548c46092abb98dba5ef2d91b12224d1106d6abfdc57862a6e26683"
      },
      "decision": "RETAIN_EXTERNAL",
      "status": "DECIDED",
      "queueEvidence": {
        "type": "DIGEST_QUEUE_EVIDENCE",
        "queueType": "DIGEST_REVIEW",
        "generatedAction": "REPLACE_DUPLICATES_WITH_REFERENCES_AFTER_REVIEW",
        "priority": 2,
        "entryCount": 2,
        "buckets": [
          "authored-local",
          "runtime"
        ],
        "sourceRoots": [
          "apollo-skills",
          "global-codex-skills"
        ],
        "candidateKeys": [
          "SKILL:plugin-creator"
        ]
      },
      "rationale": "Byte-identical entries are runtime, system, first-party, or adapter material retained in owning runtimes; do not replace from this repo.",
      "nextAction": "Leave source/runtime copies in owning locations; revisit only if a dedicated plugin family is designed."
    },
    {
      "type": "DIGEST_REVIEW_DECISION",
      "target": {
        "type": "DIGEST_REVIEW_TARGET",
        "sha256": "sha256:9ca574af14580dc7a2a3dc37a1796d17f93cb8850be66501f0799ef8603e9dc0"
      },
      "decision": "RETAIN_EXTERNAL",
      "status": "DECIDED",
      "queueEvidence": {
        "type": "DIGEST_QUEUE_EVIDENCE",
        "queueType": "DIGEST_REVIEW",
        "generatedAction": "REPLACE_DUPLICATES_WITH_REFERENCES_AFTER_REVIEW",
        "priority": 2,
        "entryCount": 2,
        "buckets": [
          "authored-local",
          "runtime"
        ],
        "sourceRoots": [
          "apollo-skills",
          "global-codex-skills"
        ],
        "candidateKeys": [
          "AGENT:openai"
        ]
      },
      "rationale": "Byte-identical entries are runtime, system, first-party, or adapter material retained in owning runtimes; do not replace from this repo.",